Owner,Number of Plants
Nucor Corp,11
Cleveland-Cliffs Inc,10
Nippon Steel Corp,8
Gerdau Ameristeel Corp,7
Commercial Metals Co,7
Steel Authority of India Ltd,6
ArcelorMittal Brasil SA,6
Steel Dynamics Inc,6
Rungta Mines Ltd,5
ArcelorMittal SA,4
JSW Steel Ltd,4
Mobarakeh Steel Co,4
JFE Steel Corp,4
Tokyo Steel Manufacturing Co Ltd,4
Government of North Korea,4
Angang Steel Co Ltd,3
Gerdau Acos Longos SA,3
Acciaierie Venete SpA,3
Tata Steel Ltd,3
Godo Steel Ltd,3
JFE Bars & Shapes Corp,3
Orissa Metaliks Pvt Ltd,3
Kyoei Steel Ltd,3
Ternium México SA de CV,3
Promsort LLC,3
Hyundai Steel Co,3
Tung Ho Steel Enterprise Corp,3
United States Steel Corp,3
Shyam Metalics and Energy Ltd,2
Khouzestan Steel Co,2
Riva Acciaio SpA,2
Outokumpu Stainless AB,2
Egyptian Steel Group,2
GV do Brasil Industria e Comercio de Aço Ltda,2
Evraz North America PLC,2
Nippon Steel Stainless Steel Corp,2
Aperam Stainless Belgium NV,2
Amsteel Mills Sdn Bhd,2
DeAcero SAPI de CV,2
Gerdau Corsa SAPI de CV,2
Aceros Especiales Simec Tlaxcala SA de CV,2
Infrabuild Australia Pty Ltd,2
Hunan Valin Lianyuan Iron and Steel Co Ltd,2
Sev.en Global Investments AS,2
SteelAsia Manufacturing Corp,2
Siam Yamato Steel Co Ltd,2
Liberty Steel Group,2
Guangxi Longzhou Zhongheng Wanhua Industrial Co Ltd,2
UMK-Stal LLC,2
Dongkuk Steel Mill Co Ltd,2
Ovako AB,2
POSCO Holdings Inc,2
ArcelorMittal España SA,2
Evonith Metallics Ltd,2
Tata Steel (Thailand) PCL,2
Kardemir Karabuk Demir Çelik Sanayi Ve Ticaret AŞ,2
Toscelik Profil ve Sac Endustrisi AS,2
Charter Manufacturing Co Inc,2
Jai Balaji Industries Ltd,2
Jindal Stainless Ltd,2
SSAB Americas Holding AB,2
Jindal Steel & Power Ltd,2
Lloyds Metals and Energy Ltd,2
Pomina Steel JSC,2
"Guangde Xinyuanda Metal Products Co., Ltd. Co Ltd",1
Anhui Shoukuang Dachang Metal Material Co Ltd,1
Anshan Baode Iron & Steel Co Ltd,1
Anyang Iron & Steel Co Ltd,1
Baoshan Iron & Steel Co Ltd,1
Baosteel Desheng Stainless Steel Co Ltd,1
Baosteel Group Xinjiang Bayi Iron & Steel Co Ltd,1
Baosteel Zhanjiang Iron & Steel Co Ltd,1
Baowu Group Echeng Iron & Steel Co Ltd,1
Bengang Steel Plates Co Ltd,1
Benxi Beiying Iron & Steel (GROUP) Co Ltd,1
Cangzhou China Railway Equipment Manufacturing Materials Co Ltd,1
Changshu Longteng Special Steel Co Ltd,1
Lucheng Xingbao Iron & Steel Co Ltd,1
Changzhou Dongfang Special Steel Co Ltd,1
Chengde Street Ltd,1
Chengde Jianlong SPECIAL Steel Co Ltd,1
Chengdu Changfeng Steel Group Co Ltd,1
Chengyu Vanadium & Titanium Technology Co Ltd,1
Chifeng Yuanlian Steel Co Ltd,1
Chifeng Zhongtang Special Steel Co Ltd,1
Chizhou Guichi Guihang Metal Products Co Ltd,1
Chongqing Iron & Steel Co Ltd,1
Chongqing Yonghang Steel Group Co Ltd,1
Danyang Longjiang Steel Co Ltd,1
Daye SPECIAL Steel Co Ltd,1
Hubei Xinxin Steel Group Co Ltd; natural person(s),1
DELONG Steel Ltd,1
Dongbei Special Steel Group Dalian Special Steel Co Ltd,1
Fangda Special Steel Technology Co Ltd,1
Fujian Great Dong Hai Industrial Group Co Ltd,1
Fujian Dingsheng Steel Co Ltd,1
Fujian Dingxin Industry Co Ltd,1
Fujian Longgang New Materials Co Ltd,1
Fujian Luoyuan Minguang Iron & Steel Co Ltd,1
Fujian Qingtuo New Material Co Ltd,1
Fujian San'an Iron & Steel Co Ltd,1
Fujian Sanbao Steel Co Ltd,1
Fujian Tsingtuo Nickel Industry Co Ltd,1
Fujian Wuhang Stainless Steel Products Co Ltd,1
Fushun HANWANG Direct Reduced Iron Co Ltd,1
Fushun New Steel Corp Ltd,1
Fushun Special Steel Co Ltd,1
Fuzhou Wuhang Steel Products Co Ltd,1
Gansu Jiu Steel Group Hongxing Iron and Steel Co Ltd,1
Guangdong Guangqing METAL Technology Co Ltd,1
Guangdong Jingye Iron and Steel Co Ltd,1
Guangdong Jinshenglan Metallurgical Technology Co Ltd,1
Guangdong Nanfang Donghai Iron and Steel Co Ltd,1
GuangDong Xinxing Ductile Iron Pipes Co Ltd,1
Guangdong Yuebei United Steel Co Ltd,1
Guangshui Huaxin Smelt Industry Co Ltd,1
Guangxi BG New Materials Co Ltd,1
Guangxi Chiji Iron and Steel Co Ltd,1
Guangxi Guigang Iron and Steel Group Co Ltd,1
Guangxi Guigang Iron and Steel Group Guigang Guibao SPECIAL Steel Co Ltd,1
Guangxi Guixin Steel Group Co Ltd,1
Hezhou Zhaoxin Hardware Products Co Ltd,1
Guangxi Hezhou Kexinda Metal Products Co Ltd,1
Guangxi Iron and Steel Group Co Ltd,1
Guangxi Liugang Zhongjin Stainless Steel Co Ltd,1
Guangxi Shenglong Metallurgical Co Ltd,1
Guangxi Wuzhou Jinhai Stainless Steel Co Ltd,1
Guilin Pinggang Iron and Steel Co Ltd,1
Guizhou Ganglian Industrial Group Co Ltd,1
Guizhou Hexing Metal Products Co Ltd,1
Guizhou United Steel (Group) Co Ltd,1
Hanshan Iron and Steel Co Ltd,1
Dazhou Hangda Steel Co Ltd,1
HBIS Laoting Steel Co Ltd,1
Hebei Anfeng Iron & Steel Co Ltd,1
Hebei Donghai SPECIAL Steel Group Co Ltd,1
Hebei Huaxi Special Steel Co Ltd,1
Hebei Huaxin Special Steel Co Ltd,1
Hebei Jinxi Iron & Steel Group Co Ltd,1
Hebei PROVINCE Longfengshan Casting Industry Co Ltd,1
Hebei Puyang Iron and Steel Co Ltd,1
Hebei Rongxin Iron & Steel Co Ltd,1
Hebei Taihang Iron and Steel Group Co Ltd,1
Hebei Tangyin IRON&STEEL Co Ltd,1
Hebei Tianzhu Iron and Steel Group Special Steel Co Ltd,1
Hebei New Wuan Lron and Steel Group Hong Rong Lron and Steel Co Ltd,1
Hebei Xinda Iron and Steel Co Ltd,1
Hebei Xinjin Iron and Steel Co Ltd,1
Hebei New Wuan Iron and Steel Group Xin Hui Metallurgy Co Ltd,1
Hebei Xinxing Ductile Iron Pipes Co Ltd,1
Hebei Yanshan Iron and Steel Group Co Ltd,1
Hebei YongYang Special Steel Group Co Ltd,1
Hbzx HIGH Tech Co Ltd,1
Hebei Zongheng Group Fengnan Iron & Steel Co Ltd,1
Heilongjiang Jianlong Iron and Steel Co Ltd,1
Henan Angang Zhoukou Iron and Steel Co Ltd,1
Henan Fengbao SPECIAL Steel Co Ltd,1
Henan Xinjinhui Stainless Steel Industry Co Ltd,1
Henan Jiyuan Iron & Steel (Group) Co Ltd,1
Henan YAXIN Steel Industry Co Ltd,1
Hengyang Valin Steel Tube Co Ltd,1
Heping Yueshen Steel Industrial Co Ltd,1
Heyuan Derun Steel Co Ltd,1
Hezhou Xindu Sanyuan Casting Co Ltd,1
Houying Group Haicheng Iron and Steel Co Ltd,1
Huainan Hongtai Steel Limited Liability Co,1
Hubei Jinshenglan Metallurgical Technology Co Ltd,1
Hubei Lijin Steel Group Co Ltd,1
Hubei Shunle Iron and Steel Co Ltd,1
Inner Mongolia BaoTou Steel Union Co Ltd,1
Inner Mongolia Desheng Metal Products Co Ltd,1
Inner Mongolia Yaxinlongshun Special Steel Co Ltd,1
Jianglong Acheng Iron & Steel Co Ltd,1
Jiangsu Province Binxin Steel Group Co Ltd,1
Jiangsu Changqiang Iron & Steel Co Ltd,1
Jiangsu Delong Nickel Industry Co Ltd,1
Jiangsu HONGTAI Metals Ware Co Ltd,1
Jiangsu Shagang Group Huaigang SPECIAL Steel Co Ltd,1
Jiangsu Xusteel Group Co Ltd,1
Jiangxi Taixin Iron & Steel Co Ltd,1
Jiangyin Huaxi Steel Co Ltd,1
Jiangyin Xicheng Steel Co Ltd,1
Jiangyin Xingcheng SPECIAL Steel Works Co Ltd,1
Jianlong Beiman SPECIAL Steel Co Ltd,1
Jianlong Xilin Iron and Steel Co Ltd,1
Jilin Jianlong Steel Co Ltd,1
Jilin Jingang Lron and Steel Co Ltd,1
JiLin Province Xinda Steel Co Ltd,1
Jinan Iron & Steel Group Co Ltd,1
Jincheng FUSHENG Iron & Steel Co Ltd,1
Jinding Heavy Industries Co Ltd,1
Jingye Iron and Steel Co Ltd,1
Jingzhou Qunli Metal Products Co Ltd,1
Jinye Steel Group Co Ltd,1
Jiugang Group Yuzhong Iron & Steel Co Ltd,1
JiuJiang PXSteel Co Ltd,1
Laiwu Steel Yinshan Section Co Ltd,1
Gaolan County Lanxin Steel Co Ltd,1
Lengshuijiang Iron and Steel Co Ltd,1
Lianfeng Steel (Zhangjiagang) Co Ltd,1
Lianyungang Huale Alloy Group Co Ltd,1
Lianyungang Xingxin Iron and Steel Co Ltd,1
Lianyungang Yaxin Iron and Steel Co Ltd,1
Liaoyang United Steel Co Ltd,1
Liaoyang Xinyi Special Steel Co Ltd,1
Licheng Taihang Iron & Steel Co Ltd,1
Lingyuan Iron & Steel Co Ltd,1
Linyi Iron and Steel Investment Group Co Ltd,1
Huahong Iron and Steel Products Co Ltd,1
Liuzhou IRON&STEEL Co Ltd,1
Liyang Baorun Steel Co Ltd,1
Luzhou Xinyang Vanadium Titanium Steel Co Ltd,1
Lvliang Jianlong Industrial Co Ltd,1
Maanshan Iron & Steel Co Ltd,1
Nanjing Iron & Steel Co Ltd,1
Nanyang Hanye SPECIAL STREET Co Ltd,1
Ningbo Haoyang New MATERIALS Techonology Co Ltd,1
Ningbo Iron & Steel Co Ltd,1
Ningxia Iron and Steel (Group) Co Ltd,1
Ningxia Jianlong Special Steel Co Ltd,1
Pan Gang Group Sichuan Changcheng Special Steel Co Ltd,1
Panzhihua Steel Group Panzhihua Steel Vanadium Co Ltd,1
Pangang Group Xichang Steel and Vanadium Co Ltd,1
Jilinheng Precision Casting Technology Co Ltd,1
Anyuan Iron & Steel Co Ltd,1
Posco (Zhangjiagang) Stainless Steel Co Ltd,1
Qian'an City Jiujiang Wire Co Ltd,1
Qian'an Zhayi Steel Group Co Ltd,1
Qingdao Special Iron and Steel Co Ltd,1
Qinhuangdao Baigong Steel Co Ltd,1
Qinhuangdao Hongxing Iron & Steel Co Ltd,1
Rizhao Steel Holding Group Co Ltd,1
Rizhao Steel Yingkou Medium Plate Co Ltd,1
Sansteel Minguang Co Ltd Fujian,1
SGIS Songshan Co Ltd,1
Shaanxi Hanzhong Iron & Steel Group Co,1
Shaanxi Huaxin Special Steel Group Co Ltd,1
Shaanxi LONG MEN IRON&STEEL Co Ltd,1
Shaanxi Lueyang Iron and Steel Co Ltd,1
Shangang Group Hanzhong Iron & Steel Co Ltd,1
Shagang Group Anyang Yongxing Iron & Steel Co Ltd,1
Fulun Iron & Steel Co Ltd,1
Shandong Iron and Steel Co Ltd,1
Shandong IRON&STEEL Group Rizhao Co Ltd,1
Shandong Iron & Steel Group Yongfeng Lingang Corp,1
Shandong Luli Steel Co Ltd,1
Shandong Shouguang Juneng SPECIAL Steel Co Ltd,1
Shanghai Meishan Iron & Steel Co Ltd,1
Shanxi Gaoyi Steel Co Ltd,1
Shanxi HONGDA Iron and Steel Group Co Ltd,1
Shanxi HUAQIANG Iron and Steel Co Ltd,1
Hejin Huaxinyuan Steel & Iron Co Ltd,1
Shanxi Jianlong Industrial Co Ltd,1
Shanxi Jinnan Iron and Steel Group Co Ltd,1
Shanxi Meijin Iron and Steel Co Ltd,1
Shanxi Taigang Stainless Steel Co Ltd,1
ShanXi TongCai Industry and Trade Co Ltd,1
Shanxi Tongde Xinghua Special Steel Co Ltd,1
Shanxi Xintai Iron & Steel Co Ltd,1
Shanxi Zhongsheng Iron and Steel Co Ltd,1
Shanxi Zhongyang Iron & Steel Co Ltd,1
Shiheng SPECIAL Steel Group Co Ltd,1
Shijiazhuang Iron and Steel Co Ltd,1
Yun County Rongfeng Rolling Mill Factory,1
Shougang Changzhi IRON& Steel Co Ltd,1
Shougang Guiyang SPECIAL Steel Co Ltd,1
Shougang Jingtang United Iron & Steel Co Ltd,1
Beijing Shougang Co Ltd,1
Shougang Shuicheng Iron & Steel (Group) Co Ltd,1
"Sichuan De Sheng Group, Vanadium and Titanium Co Ltd",1
Sichuan Gangchen Stainless Steel Co Ltd,1
Sichuan Shehong Chuanzhong Construction Materials Co Ltd,1
Sichuan Shengquan Iron and Steel Group Co Ltd,1
Sichuan Ya'an Anshan Iron and Steel Co Ltd,1
Tangshan Donghai Iron and Steel Group Co Ltd,1
Tangshan Donghua Iron & Steel Enterprise Group Co Ltd,1
Tangshan Fengnan District Jing'an Iron and Steel Co Ltd,1
Tangshan Ganglu Iron & Steel Co Ltd,1
Tangshan Guotang Steel Co Ltd,1
Tangshan Heavy Plate Co Ltd,1
Tangshan RUIFENG Steel and Iron (GROUP) Co Ltd,1
Tangshan Songting IRON&STEEL Co Ltd,1
Tangshan Wenfeng Special Steel Co Ltd,1
Tangshan Xinglong Steel Co Ltd,1
Tangshan Yutian Jinzhou Industry Co Ltd,1
Tangshan Zhengfeng Steel Co Ltd,1
Tianjin Iron and Steel Group Co Ltd,1
Tianjin Iron PLANT Co Ltd,1
Tianjin Tiangang UNITED SPECIAL Steel Co Ltd,1
Tianjin Pipe Corp,1
Rockcheck Steel Group Co Ltd,1
Tonghua Iron & Steel Co Ltd,1
Tongling Fuxin Iron & Steel Co Ltd,1
Tongling City Xuanli Special Steel Co Ltd,1
Weifang SPECIAL Steel Group Co Ltd,1
Honghe Iron and Steel Co Ltd,1
WISCO Group Kunming Steel Co Ltd,1
Wugang Zhongjia Iron & Steel Co Ltd,1
Wuhai Baogang Wanteng Iron and Steel Co Ltd,1
Wuhan Iron and Steel Co Ltd,1
Wuhan Shunle Stainless Steel Co Ltd,1
Wuhu Fuxin Iron & Steel Co Ltd,1
Wuhu Xinxing Ductile Iron Pipes Co Ltd,1
Wulanhot Iron & Steel Co Ltd,1
Wuxi Xinsanzhou Special Steel Co Ltd,1
Wuyang Iron and Steel Co Ltd,1
Wuzhou Yongda Special Steel Co Ltd,1
Xiangfen County XinJinShan Special Steel Co Ltd,1
Xining Special Steel Co Ltd,1
Xinji AOSEN Steel Group Co Ltd,1
Xinjiang Da'an Special Steel Co Ltd,1
Xinjiang Ka Steel Group Co,1
Xinjiang KingTec Steel Co Ltd,1
Xinjiang Kunyu Lron & Steel Co Ltd,1
Xinjiang Minxin Iron and Steel (Group) Minhang Special Steel Co Ltd,1
Xinxing Ductile Iron Pipes Xinjiang Co Ltd,1
Xinjiang Xin'an Special Steel Co Ltd,1
Xinjiang Yili Iron and Steel Co Ltd,1
Xinyu Iron & Steel Corp Ltd,1
Yancheng Lianxin Steel Co Ltd,1
Yangchun New Iron & Steel Co Ltd,1
Yangzhou Hengrun Ocean Heavy Industry Co Ltd,1
Yangzhou Qinyou Special Metal Materials Co Ltd,1
Yantai Walsin Stainless Steel Co Ltd,1
Yunnan Qujing Iron and Steel Group Chenggang Iron and Steel Co Ltd,1
Yunnan Qujing Iron and Steel Group Co Ltd,1
YunNan Province Tiangao Nickel Alloy Co Ltd,1
Yunnan Yuxi Iron and Steel Group Yukun Iron and Steel Co Ltd,1
Yunnan Yuxi Xianfu Iron and Steel (Group) Co Ltd,1
Zenith Steel Group Co Ltd,1
Zenith Steel Group (Nantong) Co Ltd,1
Zhangjiagang Hongchang Steel Co Ltd,1
Zhangjiagang Rongsheng Steel-Making Co Ltd,1
Zhejiang TSINGSHAN IRON&STEEL Co Ltd,1
Zhejiang Wantai Special Steel Co Ltd,1
Zhongpu (Handan) Iron and Steel Co Ltd,1
Zhongxin Iron and Steel Group Co Ltd,1
BERIS Jiangsu Heavy Industry Co Ltd,1
Zhuhai Yueyufeng IRON&STEEL Co Ltd,1
TRINECKÉ ZELEZÁRNY AS,1
AlGioshy Steel SAE,1
Al Ezz Dekheila Steel Company Alexandria SAE,1
Delta Steel Company Ltd,1
Egyptian American Steel Rolling Company SAE,1
Egyptian Sponge Iron & Steel Company SAE,1
Al Ezz Flat Steel Company SAE,1
Ezz Steel Co,1
Suez Steel Company SAE,1
ArcelorMittal Atlantique et Lorraine SAS,1
ArcelorMittal Méditerranée SAS,1
Ascometal France Holding SAS,1
Celsa France SAS,1
Lamines Marchands Europeens SA,1
ALPA - Aciéries et Laminoirs de Paris SAS,1
Iton Seine SAS,1
Sam Montereau SAS,1
Societe des Aciers d'Armature pour le Beton SAS,1
Saarstahl AG,1
ArcelorMittal Bremen GmbH,1
ArcelorMittal Eisenhüttenstadt GmbH,1
ArcelorMittal Hamburg GmbH,1
Benteler Steel/Tube GmbH,1
Stahlwerk Thueringen GmbH,1
Deutsche Edelstahlwerke GmbH,1
ESF Elbe-Stahlwerke Feralpi GmbH,1
Fujian Fuxin Special Steel Co Ltd,1
Badische Stahlwerke GmbH,1
Lech Stahlwerke GmbH,1
BES Brandenburger Elektrostahlwerke GmbH,1
HES Hennigsdorfer Elektrostahlwerke GmbH,1
Peiner Traeger GmbH,1
Sentuo Steel Ltd,1
Hellenic Halyvourgia SA,1
Sidenor Steel Industry SA,1
Sovel SA,1
Corporación AG SA,1
Action Ispat and Power Pvt Ltd,1
Adhunik Metaliks Ltd,1
ArcelorMittal Nippon Steel India Ltd,1
Arjas Steel Pvt Ltd,1
Atibir Industries Co Ltd,1
BMM Ispat Ltd,1
Crest Steel and Power Pvt Ltd,1
ESL Steel Ltd,1
Electrosteel Castings Ltd,1
Dinson Iron & Steel Company Pvt Ltd,1
Gallantt Ispat Ltd,1
Godawari Power and Ispat Ltd,1
Hospet Steels Ltd,1
Algerian Qatari Steel,1
Jai Balaji Jyoti Steels Ltd,1
Jayaswal Neco Industries Ltd,1
Ozmert Algeria SARL,1
Groupe Industriel Sider SpA,1
Tosyali Ironsteel Industry Algerie SpA,1
JSW Green Steel Ltd,1
JSW Ispat Special Products Ltd,1
JSW Vijayanagar Metallics Ltd,1
KIC Metaliks Ltd,1
Ada - Aceria De Angola SA,1
Mesco Kalinga Steel Ltd,1
Mono Steel (India) Ltd,1
MSP Steel & Power Ltd,1
NR Ispat and Power Pvt Ltd,1
Neelachal Ispat Nigam Ltd,1
Nilachal Iron & Power Ltd,1
NMDC Steel Ltd,1
Companhia Siderurgica do Cuchi SA,1
Orissa Sponge Iron and Steel Ltd,1
Prakash Industries Ltd,1
Prakash Sponge Iron and Power Pvt Ltd,1
Ramsarup Industries Ltd,1
Rashmi Metaliks Ltd,1
Rashtriya Ispat Nigam Ltd,1
Acindar Industria Argentina de Aceros SA,1
Sipar Aceros SA,1
Shakambhari Ispat & Power Ltd,1
Shri Bajrang Power and Ispat Ltd,1
Siderca SAIC,1
Shyam Steel Manufacturing Ltd,1
Shyam Steel Industries Ltd,1
Sunflag Iron and Steel Co Ltd,1
Tata Metaliks Ltd,1
Tata Steel BSL Ltd,1
Ternium Argentina SA,1
Tata Steel Long Products Ltd,1
Vedanta Iron and Steel Ltd,1
Welspun Corp Ltd,1
Yazdani Steel and Power Ltd,1
PT Mandan Steel,1
Dexin Steel Pte Ltd,1
PT Gunung Raja Paksi Tbk,1
PT Jakarta Prima Steel Industries,1
PT Krakatau Steel (Persero) Tbk,1
PT Krakatau Posco,1
PT The Master Steel MFG,1
LNM Group,1
Ahya Steel Folad Baft Co,1
Ardakan Steel Complex Co,1
Arfa Iron and Steel Co,1
Arvand Jahanara Steel Co,1
Bafgh Mineral Complex Iron & Steel Co,1
Bonab Steel Complex,1
Butia Iranian Steel Co,1
Chadormalu Mining & Industrial Co,1
Esfahan Steel Co,1
Iranian Ghadir Iron & Steel Co,1
Ghaenat Steel Complex,1
Gohar Zamin Iron Ore Co,1
Iran Alloy Steel Co,1
Sirjan Jahan Steel Co,1
Khorasan Steel Complex Co,1
Hoa Phat Hai Duong Steel JSC,1
Kish South Kaveh Steel Co,1
Mianeh Steel,1
Voestalpine Stahl Donawitz GmbH,1
Natanz Steel Co,1
Neyriz Ghadir Steel Co,1
Pasargad Steel Complex Co,1
Persian Gulf Saba Steel,1
Sabzevar Pars Steel Complex,1
Iranian Sirjan Steel Co,1
West Alborz Steel Co,1
Zarand Iranian Steel Co,1
Al Anmaa for Construction Materials Production Ltd,1
F&F Steel,1
Mass Iraq Iron and Steel Industry Co,1
Van Company for Industrial Investment and General Trading,1
Acciaierie d'italia SpA,1
Voestalpine Stahl GmbH,1
AFV Acciaierie Beltrame SpA,1
Alfa Acciai SpA,1
Acciaierie di Sicilia SpA,1
Acciaierie Bertoli Safau SpA,1
Duferco Travi e Profilati SpA,1
Acciaierie di Calvisano SpA,1
Feralpi Siderurgica SpA,1
Ferriera Valsabbia SpA,1
Acciai Speciali Terni SpA,1
Acciaieria Arvedi SpA,1
Industrie Riunite Odolesi IRO SpA,1
ORI Martin - Acciaieria e Ferriera di Brescia SpA,1
Acciaierie di Verona SpA,1
Ferriere Nord SpA,1
Siderpotenza SpA,1
Baku Steel Company QSC,1
Dalmine SpA,1
Aichi Steel Corp,1
Chubu Steel Plate Co Ltd,1
Daido Steel Co Ltd,1
Sulb Company BSCC,1
Abul Khair Steel Ltd,1
Bangladesh Steel Re-Rolling Mills Ltd,1
Kishiwada Steel Co Ltd,1
Kobe Steel Ltd,1
BSRM Steels Ltd,1
Nakayama Steel Products Co Ltd,1
Nakayama Steel Works Ltd,1
GPH Ispat Ltd,1
Sanyo Special Steel Co Ltd,1
KSRM Steel Plant Ltd,1
Osaka Steel Co Ltd,1
BMZ-Upravlyayushchaya Kompaniya Kholdinga BMK JSC,1
Topy Industries Ltd,1
Yamato Steel Co Ltd,1
Qazaqstan Steel Group LLP,1
Devki Steel Mills Ltd,1
United Steel Industries Co KSCC,1
Libyan Iron and Steel Co,1
Alliance Steel (M) Sdn Bhd,1
Ann Joo Integrated Steel Sdn Bhd,1
Ann Joo Steel Bhd,1
Eastern Steel Sdn Bhd,1
Eden Flame Sdn Bhd,1
Antara Steel Mills Sdn Bhd,1
Thy-Marcinelle SA,1
Malaysia Steel Works (KL) Bhd,1
Southern Steel Bhd,1
ArcelorMittal México SA de CV,1
Empresa Siderúrgica del Mutún,1
Outokumpu Stainless USA LLC,1
Grupo Acerero SA de CV,1
Aperam Inox America do Sul SA,1
Tubos de Acero de Mexico SA,1
ArcelorMittal Tubarão Comercial SA,1
Talleres y Aceros SA de CV,1
Moldova Steel Works JSC,1
Maghreb Steel SA,1
Riva Industries,1
Univers Acier,1
Myanmar Economic Corp,1
Hyron Africa,1
New Zealand Steel Ltd,1
Kam Industries (Nigeria) Ltd,1
Aco Verde do Brasil SA,1
Makstil AD,1
Companhia Siderúrgica Nacional SA,1
Jindal Shadeed Iron & Steel LLC,1
Moon Iron and Steel Company SAOC,1
Sohar Steel LLC,1
Agha Steel Industries Ltd,1
Amreli Steels Ltd,1
Faizan Steel,1
Ittehad Steels Pvt Ltd,1
Mughal Iron & Steel Industries Ltd,1
Corporacion Aceros Arequipa SA,1
Empresa Siderurgica del Peru SAA,1
Gerdau Acominas SA,1
Gerdau SA,1
Arcelormittal Warszawa SP zoo,1
Celsa Huta Ostrowiec SP zoo,1
CMC Poland SP zoo,1
Ferrostal Labedy SP zoo,1
Siderurgica Norte Brasil SA,1
SN MAIA Siderurgia Nacional SA,1
SN SEIXAL Siderurgia Nacional SA,1
Qatar Steel Company QPSC,1
ArcelorMittal Hunedoara SA,1
GLGH Steel,1
S.C. Silcotub SA,1
Abinski Elektrometallurgicheski Zavod LLC,1
Amurstal LLC,1
Ashinskiy Metzavod PJSC,1
MZ Balakovo JSC,1
Evraz NTMK JSC,1
Evraz ZSMK JSC,1
Ternium Brasil Ltda,1
KMK Tempo JSC,1
Lebedinskiy GOK JSC,1
Magnitogorskiy Metallurgicheskiy Kombinat PJSC,1
Chelyabinskiy Metallurgicheskiy Kombinat PJSC,1
Oskol'skiy Elektrometallurgicheskiy Kombinat Imeni Alekseya Alekseyevicha Ugarova JSC,1
Usinas Siderurgicas de Minas Gerais SA,1
Novolipetsk Steel PJSC,1
Novorossiysk Rolling Plant LLC,1
Vyksunskiy Metallurgicheskiy Zavod AO,1
Chelyabinskiy Truboprokatnyi Zavod JSC,1
Severstal PJSC,1
StavStal' LLC,1
Severskiy Trubnyi Zavod JSC,1
Taganrogskiy Metallurgicheskiy Zavod JSC,1
Uralskaya Stal JSC,1
Krasnyi Oktyabr' Corporation JSC,1
Volzhskiy Trubnyi Zavod JSC,1
Arab Steel Co,1
National Steel Co,1
Al Qaryan Steel Co,1
Rajhi Steel Industries Co Ltd,1
Saudi Iron and Steel Co,1
Solb Steel Co,1
HBIS Group Serbia Iron & Steel Beograd doo,1
Metalfer Steel Mill Sremska Mitrovica doo,1
US Steel Košice sro,1
SIJ Acroni doo,1
Columbus Stainless (Pty) Ltd,1
ArcelorMittal South Africa Ltd,1
Scaw Metals Group Pty Ltd,1
Daehan Steel Co Ltd,1
Vallourec Soluções Tubulares do Brasil SA,1
Hwanyoung Steel Industries Co Ltd,1
Andrade Valladares Engenharia e Construcao Ltda,1
KG Steel Co Ltd,1
KISCO Corp,1
Stomana Industry AD,1
SeAH Besteel Holdings Corp,1
SeAH Changwon Integrated Special Steel Corp,1
SeAh Steel Holdings Corp,1
YK Steel Corp,1
Acerinox Europa SAU,1
Algoma Steel Group Inc,1
Arcelormittal Olaberria-Bergara SL,1
Arcelormittal Sestao SL,1
Compania Espanola de Laminacion SL,1
Global Steel Wire SA,1
Nervacero SA,1
Corrugados Getafe SL,1
AG Siderurgica Balboa SA,1
Megasa Siderurgica SL,1
Megasider Zaragoza SA,1
Siderurgica Sevillana SA,1
Sidenor Aceros Especiales SLU,1
SSAB AB,1
Stahl Gerlafingen AG,1
Swiss Steel Holding AG,1
Hadeed Metal Manufacturing Co,1
Hmisho Steel SA,1
China Steel Corp,1
Dragon Steel Corp,1
E-Top Metal Co Ltd,1
Feng Hsin Steel Co Ltd,1
Hai Kwang Enterprise Corp,1
Shyeh Sheng Fuat Steel & Iron Works Co Ltd,1
ArcelorMittal Dofasco GP,1
Yieh United Steel Corp,1
Bangkok Steel Industry PCL,1
Chow Steel Industries PCL,1
Millcon Steel PCL,1
G Steel PCL,1
G J Steel PCL,1
Georgsmarienhuette GmbH,1
ArcelorMittal Long Products Canada GP,1
TY Steel Co Ltd,1
UMC Metals Ltd,1
Nu-Iron Unlimited,1
ABA Çelik Demir LŞ,1
Asil Celik Sanayi ve Ticaret AŞ,1
Çebitaş Demir Çelik Endüstrisi AŞ,1
Çolakoğlu Metalürji AŞ,1
Diler Demir Celik Endustri ve Ticaret AŞ,1
Ege Celik Endustrisi Sanayi ve Ticaret AŞ,1
Ekinciler Demir ve Celik Sanayi AŞ,1
Eregli Demir ve Celik Fabrikalari AŞ,1
Habas Industrial and Medical Gases Production Industries AŞ,1
Içdaş Çelik Enerji Tersane Ve Ulaşim Sanayi AŞ,1
Izmir Demir Celik Sanayi AŞ,1
Iskenderun Demir ve Celik AŞ,1
Kaptan Demir Celik Endustrisi Ve Ticaret AŞ,1
Ivaco Rolling Mills 2004 LP,1
Koc Metalurji AŞ,1
Kroman Celik Sanayii AS,1
Mescier Demir Celik AŞ,1
MMK Metalurji Sanayi Ticaret ve Liman Isletmeciligi AŞ,1
Ozkan Demir Celik Sanayi AŞ,1
Sıddık Kardeşler Haddecilik Sanayi Ticaret LŞ,1
Rio Tinto Iron and Titanium Canada Inc,1
Yazici Demir Celik Sanayi ve Turizm Ticaret AŞ,1
Yesilyurt Demir Celik Endustri Ve Liman Isletmeleri AŞ,1
Tembo Steels Uganda Ltd,1
Alchevsk Metallurgical Plant PJSC,1
ArcelorMittal Kryvyi Rih PJSC,1
Interpipe Ltd,1
Kamet-Steel PrJSC,1
Zaporiz'kyi Metalurhiinyi Kombinat Zaporizhstal' PJSC,1
Yenakiieve Metallurgical Plant Branch PJSC,1
SUE DPR UMP,1
Arabian Gulf Steel Industries Selling Port LLC,1
Emsteel Building Materials PJSC,1
Alton Steel Inc,1
AM/NS Calvert LLC,1
North Star BlueScope Steel Ltd,1
Cascade Steel Rolling Mills Inc,1
Aceros AZA SA,1
"Xinyang Iron & Steel Co.,ltd of Angang Group",1
A. Finkl & Sons Corp,1
Hybar LLC,1
JSW Steel USA Ohio Inc,1
Sterling Steel Co LLC,1
Metallus Inc,1
NLMK Indiana LLC,1
North American Stainless Inc,1
Angang Lianzhong Stainless Steel Corp,1
Nucor Steel Decatur LLC,1
Nucor Steel Kankakee Inc,1
Nucor Steel Louisiana LLC,1
Nucor Steel Memphis Inc,1
Nucor Steel Seattle Inc,1
Nucor Steel Tuscaloosa Inc,1
Nucor Yamato Steel Co,1
Optimus Steel LLC,1
BlueScope Steel Ltd,1
Anhui Changjiang Steel Co Ltd,1
Anhui Guihang Special Steel Co Ltd,1
Big River Steel LLC,1
Anhui Jin'an Stainless Steel Foundry Co Ltd,1
Vallourec Star LP,1
Uzbekskiy Metallurgicheskiy Kombinat JSC,1
Corporacion Venezolana de Guayana,1
Briquetera del Orinoco CA,1
Complejo Siderurgico de Guayana CA,1
CVG Ferrominera Orinoco CA,1
Siderurgica del Orinoco Alfredo Maneiro CA,1
Asean Steel JSC,1
Formosa Ha Tinh Steel Corp,1
Hoa Phat Dung Quat Steel JSC,1
Lao Cai Cast Iron and Steel,1
Pavgord doo,1
Anhui Langxi County Fuhang Steel Co Ltd,1
Posco Vietnam Co Ltd,1
Shengli Vietnam Special Steel Co Ltd,1
Thai Nguyen Iron And Steel JSC,1
Tung Ho Steel Vietnam Corp Ltd,1
Tuyen Quang Iron Steel Co Ltd,1
VAS Steel An Hung Tuong LLC,1
Nghi Son VAS Group JSC,1
VAS Steel Tue Minh JSC,1
Viet Nhat Advanced Steel JSC,1
Vietnam - Italy Steel JSC,1
Vina Kyoei Steel Ltd Co,1
Vina One Steel Manufacturing Corp,1
VNSTEEL Southern Steel Co Ltd,1
ArcelorMittal Poland SA,1
